회사,직무,자소서
행정안전부,빅데이터·AI(인공지능),"
기업 서포터즈 활동을 하며 지역 상권에 맞는 상품기획 프로젝트에서 기획부장을 담당하며 회의를 진행했습니다. 상품의 타깃층, 목적 등을 기반으로 효과적인 상품과 기대효과 등을 종합한 보고서를 작성하여 일주일이라는 기한 내에 제출해야 했습니다. 저는 모든 팀원들의 이야기를 수용하고 존중하며 모두가 만족할 수 있는 결과를 내는 것이 최선이라고 생각했습니다. 하지만 회의에 있어서는 이러한 열린 태도가 효과적이지 못하다는 것을 알게 되었습니다. 모두의 의견이 일치하기 위해서는 시간의 효율성이 너무 떨어졌기 때문입니다. 우선 지역 상권 내에서 가장 효과적인 상품을 기획하자라는 공동의 목표가 있다는 점을 강조하며 우선순위를 정해 부족한 점을 상호 협의를 통해 보완해나가는 방식으로 변경했습니다. 상대의 의견을 수용하는 태도 덕분에 사람들과 적극적인 의사소통은 가능했지만 무조건 남에게 맞추는 것은 좋은 점이 아님을 깨닫고 저의 주장을 조금씩 펼치기 위해 노력하고 있습니다. 

2년 전 패스트푸드점에서 홀 관리 담당으로 근무했습니다. 영화관 옆에 위치해있어 영화 시작 시간이 임박해오면 대기시간이 길다고 불만을 호소하는 손님들이 하루에 평균 10분 정도 있었습니다. 반복되는 컴플레인으로 고객과 직원 모두 힘들어하고 있었기 때문에 고객만족도 향상과 매장 이미지를 개선하기 위한 방법을 고민했습니다. 고객이 생각했던 이상으로 기다렸다고 느끼거나 얼마나 기다려야 될지 짐작이 가지 않을 때 심리적으로 기다리는 시간이 길다고 느낀다는 것을 고객 심리 관련 서적을 통해 알게 되었습니다. 그래서 저는 점장님께 말씀드려 여러 대의 스톱워치를 구매하였습니다. 결제와 동시에 대기시간을 입력한 스톱워치를 제공했습니다. 결과적으로 대기시간 관련 불만 손님들이 하루 평균 10명에서 5명으로 감소하는 효과뿐만 아니라 서비스 관련 컴플레인도 이전보다 줄어든 효과를 볼 수 있었습니다.  사소한 의견도 큰 도움이 될 수 있다는 생각으로 책임의식을 가지고 적극적인 자세로 업무를 수행하겠습니다. 

대학교 수업 중 모의 경영 시뮬레이션을 진행한 적이 있습니다. 저희 팀의 목표를 가장 많은 투자를 받아 1위를 하는 것이었습니다. 짧은 시간 내에 좋은 성과를 내고 싶은 마음에 정리되지 않는 의견들만 분분했습니다. 그래서 저는 목표를 달성하기 위해 해야 할 일들을 하나씩 정리하기 시작했습니다. 우선 크게 기획부와 홍보부로 나누어 분업을 했습니다. 부별로 회의를 진행할 수 있게 하고 그다음 통합 회의를 진행했습니다. 그러자 다양한 의견만 가득했던 회의가 보다 구체적이고 완성도 있어졌고 방향성을 갖게 되었습니다.  또한 모두 각자의 역할에서 노력할 수 있었습니다. 결과적으로 목표였던 종합 1위를 할 수 있었습니다. 이를 통해 조급한 마음을 버리고 눈앞의 일들을 하나씩 차근차근하다 보면 좋은 결과도 자연히 따라오게 된다는 것을 느끼게 되는 계기가 되었습니다. 

이번 업무에 있어서 가장 필요한 기술은 컴퓨터 활용을 기반으로 각 기준에 맞게 데이터를 분류하는 기술이라고 생각합니다. 저는 예전부터 컴퓨터와 관련된 자격증을 취득해 기초를 다져왔고 데이터 수집 및 처리 능력을 기르기 위해 관련 지식과 활용 능력을 갖추도록 노력했습니다. 학기 중에는 관련 수업을 신청해서 들으며 기초 지식을 쌓고 방학 중에는 빅데이터 분석 교육, 산업체 데이터 교육 등을 기반으로 분석력, 해석 능력 및 실무능력을 키웠습니다. 또한 음식점에서 아르바이트하며 식자재를 목록에 맞게 분류하는 일을 하면서 기준에 맞게 분류하여 등록하는 일의 중요성을 몸소 깨닫게 되었습니다. 경험을 통해 느낀 중요성을 바탕으로 기관 내 공공 데이터의 목록을 구성하고 등록하는 업무를 책임의식을 갖고 꼼꼼하게 처리하겠습니다. 컴퓨터 활용 능력을 기반으로 업무 수행을 위한 교육에 적극적이고 성실하게 수행하여 실제 업무를 이행하는 데에 도움이 될 수 있도록 하겠습니다. 
"
한국전력공사,IT·디자인·컴퓨터강사,"
“집안에 꾸린 미니어처 정보처리 시스템, 기업의 서버와 네트워크를 닮다” 자택에 개인 서버를 제작하여 운용 중입니다. 기업의 실제 정보처리 시스템의 축소판을 구현하려 했으며, 이는 직접 업무를 담당하게 되었을 때 무척 유용하리라 생각합니다. 그 과정에서 여러 오류와 호환성 문제 등을 직면했고, 끈기 있게 해결하여 고부하 상태에서도 안정적인 서버 환경을 만들었습니다. 제작 중인 웹페이지도 호스팅 중이며 함께 사는 가족이 끊김 없는 파일 공유 서비스(NAS)를 이용 중입니다. 이를 통해 서비스 중개 프로그램과 서버 보안에 대해 더욱 깊이 이해할 수 있었습니다. 또한, 이를 문서로 만들어 관련 자료를 보존 중입니다.  그리고, 600평 부지 안의 여러 채의 자택 건물에 인터넷망을 재구축한 경험이 있습니다. 기존 네트워크는 필요에 따라 증설해온 연유로 효율적이지 못해 서버가 제공하는 서비스와 인터넷 품질 저하가 심했습니다. 이에 새로 랜선을 깔고 공유기들을 교체하여 효율적인 망을 구축했습니다. 이를 통해 네트워크 장비와 관련 소프트웨어 관리 경험을 쌓을 수 있었고, 서버에 부하가 강하게 걸리더라도 가족이 고품질 인터넷을 사용할 수 있게 되었습니다. 

“두 개의 전공, 네 배의 가치를 쥔 융합적 인재를 지향하다” 저는 전자공학 전공 중 정보통신공학과로 전과, 6년의 긴 재학 기간 끝에 졸업했습니다. 이는 영어학 복수전공의 부담도 있었지만, 많은 경험을 쌓으려 다양한 활동을 했기 때문입니다. 컴퓨터가 좋아 디지털 관련 과목을 주로 수강했고, 관련 연구실에 학부 연구생으로 들어가 여러 프로젝트에 참여했습니다. 컴퓨터공학과 종합설계 참여 후, 그와 유사한 정보통신공학과에서 흥미로운 과목들을 더 배울 수 있다고 판단하여 전과했습니다. 기계어에 가까운 저급 언어부터 사용자와 밀접한 고급 언어까지 두루 배웠고, 당시 잘 몰랐던 정보처리 지식도 쌓았습니다. 하지만 컴퓨터 공학은 연구할수록 배울 것이 무궁무진하게 많다고 느끼며 실력 부족을 체감했습니다.  이에 전자계산기조직응용기사 취득, 전자계산기기사 실기와 정보처리기사 필기에 응시할 예정입니다. 또한, ESS 설비와 같은 신도입 기술을 찾아 배우겠습니다. 미래형 인재는 통합할 수 있는 사람이라 생각합니다. 원자단위의 작은 반도체부터 전 세계의 그리드 시스템까지 다루는 자, 공학과 인문학 두 개의 받침대를 가진 파이형 인재가 되기 위해 끊임없이 노력하겠습니다. 

“오해를 풀어준 경청과 대화” 조별 과제로 복잡한 프로그램을 개발한 적이 있습니다. 나이 차가 많이 나는 저학년생과 팀을 꾸렸습니다. 프로젝트 규모와 문서작업 비중이 컸기에, 효율 증진과 문서작업 병행이 가능한 폭포수 모델의 소프트웨어 개발 프로세스를 따르자고 제시하였습니다. 하지만 개발 진행은 더뎠고, 프로젝트 모듈화가 계획대로 되지 않아 기능들이 정상 작동하지 않았습니다. 그대로 프로젝트를 진행하면 문제가 있을 것으로 판단하였습니다.  그래서 개발 중반쯤 상의를 하여 팀원이 프로세스를 따르지 않는 것과 문서화가 더딘 이유에 관해 물었습니다. 대답을 들어 보니 팀원은 저학년이라 개발 경험이 부족했고, 개발 프로세스에 대해 배우지 않아 이해도가 낮았으나 나이 차이의 압박과 부족한 시간에 쫓겨 따라오기 바빴던 것입니다.  팀원의 이야기를 듣고 나서야 저는 팀원의 처지를 이해할 수 있었습니다. 팀원이 이해할 수 있게끔 프로세스를 설명하고, 업무 재분배를 통해 좋은 결과를 내었습니다. 또한, 프로젝트팀장으로서 인력 관리 기법을 얻었습니다. 앞으로 불통이나 오해가 생겼을 때 대화가 필요하며 상대방의 처지에서 공감할 수 있어야겠음을 느꼈습니다. 

“조그만 노력이 가져다준 공익증진의 기쁨” 사회복무요원 복무 중 맡았던 사무업무는 엑셀을 많이 사용했습니다. 대부분 어려운 작업은 아니었으나 시간이 매우 오래 걸리는 단순 업무였습니다. 엑셀의 함수와 매크로 기능을 십분 활용하면 자동화가 가능할 것이란 생각이 문득 들었습니다. 근무 중이던 지역아동센터는 이미 인력 부족을 겪고 있었고, 제 전역 이후 새 요원 배치 예정이 없었습니다. 추후 요원업무의 인계로 인한 종사자들의 업무강도 상승을 줄이기 위해 더욱 이 자동화 작업이 필요했습니다.  자동화 작업은 프로그램 제작과 흡사하여 어렵지 않았으나, 작업량이 많았고 지역아동센터 특성상 한 가지 업무에 계속 집중할 수 있는 환경이 아니어서 전체 작업을 마치기까지 2주가 넘게 소요됐습니다. 그리고, 추후 자동화 양식 수정이 필요하거나 이용자가 사용법을 모를 수 있어 이용법과 구조 설명을 담은 매뉴얼도 같이 만들었습니다.  그 결과 매월 요원 두 명이 16시간 동안 하던 작업을 한 명이 1시간 안에 끝낼 수 있는 양식이 완성됐습니다. 덕분에 종사자들은 좀 더 아동을 돌보는 데 시간을 할애할 수 있게 되었고, 저의 소집해제 후에도 업무 부담이 줄었다고 말씀하십니다. 
"
티맥스그룹  ,QA·테스터·검증,"
지금의 티맥스를 있게 해준 '제우스' 와 '티베로' SW를 보면서 원천 기술 확보의 중요성을 알고 있는 몇 안 되는 회사라고 느꼈고, 또 한 번 도약을 위해 약 1조 원 규모의 기술 투자를 아끼지 않는 뉴스를 접하면서 제가 평생 몸담을 수 있는 회사라는 확신이 들어 지원하게 되었습니다. 몇십 년이 지난 지금까지 미들웨어 부문 국내 1위, 국내 최고의 DBMS 시스템을 넘어 유수의 대기업과 해외 공공기관에까지 그 영향을 미치는 점은 이를 뒷받침하는 근거라 생각합니다.  입사 후에는 연구실에서 1년 넘게 보조 연구원으로 지내며 연구한 지식을 기반으로 기술 창업을 준비한 역량을 바탕으로, 티맥스의 기술을 활용해 새로운 산업군을 찾아 회사의 매출에 직접 영향을 미치는 영업, 컨설팅, 사업기획과 같은 업무를 하면서 다시 한 번 큰 도약의 기회를 제 손으로 직접 만들고 싶은 포부를 가지고 있습니다.  저의 가장 큰 장점을 꼽자면 아무래도 스타트업 창업을 준비한 이력이 있는 만큼 기술에 대한 이해도가 빠르고 남을 설득하고 이해하는 데에 있어서 열정적인 성격이라는 점입니다. 항상 현재에 안주하지 않고 미래에 일꾼으로서 다양한 역량을 기르기 위해 기계공학뿐만 아니라 SW 중심의 대내외 교육을 수강했고, 이를 바탕으로 생체기술 논문 등재, 파이낸셜 현상 공모, 스타트업 준비, AI 교육 수료 등 도전을 통해 성취감을 느꼈습니다.   단점은 적극적이고 열정적이다 보니 승부욕이 강하다는 점입니다.저뿐만 아니라 내 사람, 내 팀이 깨지면 부족한 부분을 만회하기 위해 밤을 새워서라도 수정하거나 부족한 논리나 자료 부분을 보충해 상대방이 설득될 때까지 집요하게 파고드는 성격입니다. 이러한 장단점을 조화시켜  4차산업의 핵심인 기술과 기술의 융합과 연결을 활용해 창의성을 발휘하여 사업모델을 제안하는 방위사업청 주관의 창업경진대회에서 방위사업청장상 동상을 수상한 경험이 있습니다. 특히 저의 사업아이템은 창조와 도전을 나타내는 미래기술을 활용한 ICT 웨어러블 기기로써, 화생방전에 쓰이는 국방기술을 활용해 추락, 충돌과 더불어 민간의 3대 안전사고인 ""질식"" 사고를 막고자 개발한 아이템입니다. 현재 시장에 나온 질식사고 예방 기기와 가장 큰 차이점은 내부 작업자가 ""웨어러블 형태""의 기기를 착용하고 실시간으로 생체신호와 유해가스 농도를 ""동시에"" 측정하여 외부의 작업자에게 보내는 ""하나의 시스템""이라는 점입니다. 단순한 아이디어 대회가 아닌 창업을 목표로 하는 대회니 만큼, 사업계획서 작성과 비즈니스 모델 구축에 심혈을 기울였습니다. 평소 안전하고 더불어 사는 세상을 추구하던 아이템을 만들고 싶었던 저는, 처음 설계를 기획할 때부터 안전사고 예방이라는 사회적 공공의 가치를 실현하는 아이템으로 컨셉을 잡았습니다. B2G 모델을 기본 베이스로 깔았고, OOOOOO의 2019년도 사업 보고서를 참고하여 나라장터에서 어떤 분야의 사업을 따낼지 구체화했습니다. 또한 OOOOOO, OOOOO 주관의 교육을 수강하면서 사업의 트렌드를 읽는 방법과 고객이 원하는, 시장에서 정말 팔릴 수 있는 이론을 배웠습니다.결과도 좋았지만 제 인생에 있어서 가장 도전적이고 어려웠던 일이기도 합니다. 총 3명과 팀을 꾸려 팀장 역할을 맡았었고, 나머지 인원들은 연구실 과제 참여를 통해 알게 된 전자공학부 학생과 의공학 연구실의 후배였습니다. 이렇듯 다양한 사람들이 팀을 이루다 보니 의견차이가 발생 할 수 밖에 없었습니다. 그때 마다 저는 팀원의 요구를 들어 주는 대신에 다른 비교적 쉬운 업무를 부여 함으로써 갈등상황을 해결했습니다. 제 욕심에는 측정한 Data에 딥러닝 기술을 적용해 에러를 최소화하는 기술까지 시제품에 적용하고 싶었습니다. 하지만 토론 결과, 전자공학부 팀원이 기술에 투자한 노력 대비 심사의원에게 어필할 수 있는 매력이 떨어진다는 의견에 동의해 미래 사업계획에만 포함했습니다. 딥러닝 기술 적용에서 한발 물러서 양보하는 대신, 그 학생이 가장 자신있어하는 통신 기술과 관련된 임무를 추가로 부여했습니다. 밀폐공간에서의 통신에 대하여 경진대회 멘토분과 함께 군 전술 통신 적용 방안 연구에 대한 기술 조언을 듣기위한 모임에 참여하는 것이었습니다. 이렇게 소통을 통해 갈등이 생겼을 때 적절하게 다른 업무를 부여하면서 공동의 목표에 앞으로 나아가는 방향으로 문제를 해결했고 151개 팀 중 6위라는 좋은 결과로 입상할 수 있었습니다.  
"
현대엠엔소프트(주),QA·테스터·검증,"
먼저 현대엠엔소프트 회사에 관심이 가지게 된 이유는, 기존의 내비게이션 솔루션뿐만 아니라 모빌리티 커넥티비티와 다양한 모빌리티 인포테인먼트 기술 개발에 지속적인 투자를 아낌없이 하고 있다는 뉴스를 자주 접했기 때문입니다. 그중에서도 임베디드 S/W 품질 평가 직무는 제가 여지까지 해온 활동들과 일치한다고 생각해 지원하게 되었습니다.   저는 임베디드 시스템을 활용해 자율주행로봇 경진대회 금상 수상과 생체신호를 활용한 1편의 논문 등재 및 창업경진대회에서 방위사업청장 상을 수상하며 여러 가지 결과물을 내왔습니다. 주로 임베디드 SW 개발을 하다 보니, 지속가능한 성장을 위해서는 SW 품질이 중요하다는 것을 알게 되었습니다. 따라서 관련 자격증을 취득하면서 이론을 접할 수 있었고, 입사 후에는 궁극적으로 고객들이 만족할 수 있는 임베디드 SW 개발 평가를 위해 공학적인 백그라운드 지식과 SW 평가 지식을 아우르는 결과물을 내고 싶습니다. 

저는 그동안 임베디드 SW 품질평가에 관심을 가지기까지 주로 개발을 해왔었고, 이 지식을 바탕으로 지속가능한 SW 개발을 위해서는 SW의 품질이 중요하다는 것을 깨달았습니다. 이를 통해 2020년 하반기에는 관련 자격증을 취득하는 노력을 하면서 지원 직무 수행을 위해 전문 지식을 쌓아 나갔습니다. 앞서 저는 1년여간의 의공학 연구실에서 연구원 생활과 연구소 인턴 경험을 통해 생체신호 시스템 설계를 주로 했습니다. 당연히 기계공학도로서 SW 중심의 시스템 설계가 쉬운 일이 아니었습니다. 하지만 제가 정말 하고 싶은 일이었고, 미래 먹거리는 데이터를 분석하는 SW 시스템이 될 것이기를 알았기에 다음과 같은 노력을 꾸준히 했습니다. 먼저 친해지기 위해 노력했습니다.학부 과정상 기껏 배우는 SW는 Matlab과 C언어의 기초일 뿐이고 그 역시 단순한 식과 숫자계산입니다. 저는 그 너머의 한 단계 도약하고 싶은 마음에 의공학 연구실에 직접 찾아가 따로 시험공부까지 준비했고, 그렇게 학부 연구생 생활을 시작했습니다. 교수님께 따로 SW 프로그램을 배우며 생체신호 데이터를 분석하고 정리하며 박사과정 학생을 보조하며 수많은 연구에 참여했습니다. 지치고 게을러질 때쯤, 꾸준한 노력을 지속하고자 도전을 했습니다.대한OOOOOOO에서 열리는 딥러닝 SW 교육, OOOO 딥러닝 교육, OO(한국OOOOOOOO) OOOOO 시스템 실습세미나, 미래형 커넥티드 카 전문가 교육과정 참여 등을 통해 아직도 부족한 저를 채찍질하며 다양한 SW를 다루기 위해 학기 중에 부산, 서울, 여수, 경기도 곳곳을 누비며 다녔습니다.  위와 같은 노력을 바탕으로 1편의 논문등재와 함께 웨어러블 기기 설계로 창업까지 준비하는 전문가가 되어있었고, 이러한 SW 공학 지식을 기반으로 SW품질평가 관련 자격증을 취득하면서 항상 꾸준히 노력하는 방법을 터득하여, 처음 보는 분야에서도 금방 따라잡을 수 있는 힘을 기를 수 있었습니다.  

""수면장애 진단기기 데이터 신뢰성 테스트 경험"" OOOOO 연구소 인턴을 하면서 생체신호 데이터 시험/분석 관련 프로젝트를 수행한 경험이 있습니다. 직접 수면상태에서 심박수와 산소포화도, Pulse Transit Time(PTT) 를 측정해보고 시중에 나온 제품과 결과를 비교해보는 과제였습니다. 과제를 하면서 어려웠던 점은 무엇보다도 높은 수준의 생체신호 데이터 측정 프로세스 개발과 신뢰성 확보였습니다. 처음에는 다양한 환경에 의한 에러가 발생할 수 있다는 생각 없이 모두가 사용하는 녹색 광원을 선택했고, 동잡음에 의한 에러에 대한 경험을 해본 적이 없어 투과형 형태로 시험을 기획했습니다.   역시 첫 실험의 결과는 참담했고, 학부 수업과 논문 스터디를 통해 녹색광이 아닌 적색광 사용, 투과형이 아닌 반사형으로 평가, 앨리어싱 현상을 고려한 샘플링 속도 조절이라는 방법을 통해 기술적 문제를 해결했습니다. 수면상태에서의 움직임에 의한 이격 발생과 그에 따른 빛의 침투 깊이를 고려했을 때, 더 투박하지만, 안정적인 RED 광을 선택했습니다. 또한 반사형 형태의 기기로 평가 절차를 바꾼 이유 역시 동잡음에 대한 오류를 최소화 하기 위함이었습니다. 따로 동잡음 제어 필터로 자이로 센서를 사용하지 않았기 때문에 측정의 신뢰성이 낮을 것 같다는 예측을 했기 때문에 위와 같은 절차를 적용했습니다.  마지막으로 샘플링 속도 조절을 통해 특정 주파수에서 발생하는 앨리어싱 현상을 최소화할 수 있는 분석 노하우를 익히면서 프로젝트에 쓰이는 RAW Data를 훌륭히 얻어내 의미 있는 값을 얻을 수 있었습니다. 
"
