회사,직무,자소서
㈜엔씨아이티에스,네트워크·서버·보안,"
""경쟁을 통한 성장"" 어린 시절부터 특별한 점이 없는 평범한 아이였습니다. 그래서 주변 친구들에 대한 경쟁의식이 높았습니다. 누군가가 무엇인가를 했다 하면 그만큼은 할 수 있다는 욕심이 들었습니다. 첫 시작은 10살이 되던 해, 한 살 터울의 사촌 동생에 대한 경쟁입니다. 천자문을 외우며 신동 소리를 듣자, 나도 할 수 있다는 생각이 들어 한자 학습지를 시작합니다. 그 후 4년간 배우며 한자검정으로 성취감도 느꼈고, 그 덕에 중고등 시절 한문 과목에서 우수한 성적을 받았습니다. 학창시절에는 세계지리를 외우는 친구와 경쟁이 붙어 세계지도를 외우기 시작했고, 그 특기로 골든벨에 출연하게 됩니다. 또 한 번은 친구의 작문 실력이 일취월장하자, 독서논술을 시작하여 생애 처음으로 논술대회에서 입상합니다. 예나 지금이나 저는 평범한 사람입니다. 하지만 발전하고 싶다는 열망은 가득합니다. 앞으로도 주위 사람들의 강점을 제 것으로 소화하여 자기계발을 하겠습니다. 

1. 개발능력매 학년마다 C/C++, JAVA 등 다양한 언어배웠고, 배운 언어를 토대로 개발프로젝트를 진행했습니다. 평소에 쓰레기로 흘러넘치는 쓰레기통의 문제를 눈여겨 봤기에 쓰레기통 관리페이지를 개발하기로 결심했습니다. 2인1조로 프로젝트를 진행하며 저는 DB와 서버를 담당했습니다. 센서에서 뚜껑개폐여부, 적재량, 화재여부 등을 실시간으로 값을 받아 DB에 저장하고 웹에 띄우는 작업수행했습니다. 하지만, 교내 내부IP를 받아 작업했기에 완성된 웹에 접근할 수 없는 치명적인 문제가 발생했습니다. 당시 교수님과 선배들도 전산실에서 새 IP주소를 받는 것을 추천했습니다. 하지만 저는 네트워크의 구조를 이해하며 DNS를 새로 지정함으로써 문제를 해결했습니다. 완성된 작품으로 개발프로젝트 과목에서 A를 받았고, 강의실쓰레기통과 연계시켜 효율적인 관리로 수거비용 절감을 이끌어냈습니다. 2. 시스템운용인터넷보안을 수강하며 라우터를 이용한 네트워크 구축을 했습니다. 동적, 정적 라우팅 테이블을 구성 및 재분배해봤고, 리눅스를 이용하여 방화벽도 구축했습니다. 보안네트워크에서는 패킷을 실시간 분석하며 방화벽설정 및 정책설정 같은 방어 활동을 수행했습니다. 졸업 후. 8개월간 정보보안 교육과정을 이수하며 보안장비 운영법 과 취약점 점검법을 배웠습니다. 해당 과정에서 배운 내용을 바탕으로 네트워크 관리사 2 급과 정보처리기사에 도전하여 합격했고 지금은 정보보안기사를 목표로 보안법규를 학습중입니다. 

수험생 시절, 사이버테러에 관한 다큐멘터리를 보고 이 길에 들어섭니다. 다큐 속 9살 소년이 TV 리모컨을 조작해 일으킨 열차사고는 저에게 큰 충격을 주었습니다. 그 후로 사이버테러와 바이러스의 역사를 짚어보며 정보보안 공부를 시작했습니다. IT보안을 공부하며 편리한 서비스개발보다 기업의 자산과 정보를 최우선으로 하는 것이 중요하다고 깨달았습니다. 이를 위해 저는 체계적이고 지속적인 정보보호 활동을 하겠습니다. 과거의 금융, 통신, IT기업의 해킹사례를 분석하여 방어정책을 수립하고, 매년 보안콘퍼런스에 참석하여 신기술과 보안정보를 습득하겠습니다. 쌓은 실무경험을 바탕으로 CISSP와 CISA를 취득하여 국제수준의 보안기술능력을 얻겠습니다. 그리하여 안정적인 시스템관리를 위해 ISMS-P인증 획득에 이바지하겠습니다. 
"
서울시설공단,시스템프로그래머,"
첫째, 개발능력 프로그래밍에 기초가 되는 C언어를 수강할당시, 조장을 맡았습니다. 조원들 과제도 살펴주고 모르는 부분은 같이 공부하거나 알려줌으로써 리더쉽도 기르고 A+도 성취하는 좋은 기회였습니다. 매 학년마다 C++, JAVA, python 등 다양한 언어배웠고, 배운 언어를 토대로 개발프로젝트를 진행하였습니다. 프로젝트에서는 웹서버 구축을 담당하였고, 라즈베이파이에 데비안을 설치하여 DB에 저장된 값을 웹서버에 올려보는 작업을 하였습니다.  둘째,안정적인 시스템운용 인터넷보안을 수강하며 라우터를 이용한 네트워크 구축을 하였습니다. 동적, 정적 라우팅 테이블을 구성 및 재분배해봤고, 리눅스를 이용하여 방화벽도 구축하였습니다. 보안네트워크에서는 패킷을 실시간 분석하며 방화벽설정 및 정책설정 같은 방어 활동을 수행하였습니다. 졸업 후. 8개월간 정보보안 교육과정을 이수하며 보안장비 및 안정적인 서버운영을 위한 취약점 점검법을 배웠습니다. 해당 과정에서 배운 내용을 바탕으로 네트워크 관리사 2 급과 정보처리기사에 도전하여 합격했습니다. 최종적으로는 정보보안기사를 취득하는 것이 목표입니다.  셋째. 능독적 학습 능력 html과 jsp를 학습하기위해 친구들과 웹프로그래밍 스터디를 한 적이 있습니다. CSS를 활용한 간단한 웹페이지 제작부터 DB를 연동한 게시판제작까지 해보며 역량을 키울 수 있었습니다. 이 스터디를 통해 웹페이지 구축과목에서 A를 취득하였습니다. 또한 3년동안 IT박람회를 참관하며 신제품과 기술들을 직접보고 설명을 들으며 견문을 넓혔습니다. 

""리더십-문제를 해결하는 능력"" 경영정보시스템 과목을 수강할 당시, 기업보안을 주제로 프로젝트를 진행하였습니다. 앞장서서 과제수행을 하기 위해 조장을 자진했고, 조원들의 의견을 수렴하여 각자 역할을 분배하였습니다. 초반에는 조원들 모두 맡은 업무에 성실히 임하였으나, 시간이 흐를수록 침묵만이 흘렀습니다. 결국, 중간점검 때 다른 조에 비하여 완성도는 떨어졌고 교수님의 질문에는 대답조차 할 수 없었습니다. 발표가 끝나고 미흡한 부분에 대하여 의견을 나누어보니, 생각한 것보다 찾는 정보가 없고 흥미가 줄어들었다는 의견이 다수였습니다. 그래서 조원들의 참여를 이끌기 위한 다양한 방법을 찾습니다. 우선, 팀원들과 함께 월드 IT 쇼에 같이 참관하게 됩니다. 침해사고에 대응하는 보안제품과 신기술들을 접해 볼 수 있었고 앞으로의 정보보안과제에 대해 알 수 있었습니다. 또한, 원활한 과제진행을 위해 IT 기업탐방을 신청합니다. 비록 기업보안이 대외비라서 인프라와 기술은 알 수 없었지만, 실무자와 인터뷰를 진행하며 궁금한 점들을 해소할 수 있었습니다. 짧은 시간 안에 친밀감도 쌓고 참여도를 높여 프로젝트를 완수할 수 있었습니다. 이를 계기로 소통과 협조의 중요성을 깨닫게 됩니다. 공사업무 수행 시 팀원들의 의욕저하로 업무수행이 삐걱거릴 때마다 환기할 방법을 모색하여 성공적으로 마칠 수 있도록 일조하겠습니다.  

OO도서관에서 봉사활동을 할때의 일입니다. 저는 2층 종합자료실에서 인원이 부족한 1층 어린이 도서관으로 배치되었습니다.같은 크기의 공간이지만 서가정리의 일은 배로 늘었습니다. 성인들과 달리, 어린이들은 자기만 읽으려고 책을 숨켜두거나읽던 책을 바닥에 두고 새로 꺼내오는 경우가 많았습니다. 그래서 저는 '착한어린이'와 '나쁜어린이'라는 두 단어로 아이들의 행동을 바꾸기 시작했습니다. 다 읽은 책을 북카트에 꽂거나 자리를 정리하면 착한어린이라며 크게 칭찬하고, 많은 양의 책을 꺼내오거나 책을 어질러 놓으면 나쁜어린이라고 일러준뒤, 착한어린이가 되는 방법을 말해주며 올바른 행동을 하도록 이끌어주었습니다. 

경영정보시스템 과목을 수강할 당시, 기업보안을 주제로 프로젝트를 진행하였습니다. 앞장서서 과제수행을 하기 위해 조장을 자진했고, 조원들의 의견을 수렴하여 각자 역할을 분배하였습니다. 초반에는 조원들 모두 맡은 업무에 성실히 임하였으나, 시간이 흐를수록 침묵만이 흘렀습니다. 결국, 중간점검 때 다른 조에 비하여 완성도는 떨어졌고 교수님의 질문에는 대답조차 할 수 없었습니다. 발표가 끝나고 미흡한 부분에 대하여 의견을 나누어보니, 생각한 것보다 찾는 정보가 없고 흥미가 줄어들었다는 의견이 다수였습니다. 그래서 조원들의 참여를 이끌기 위한 다양한 방법을 찾습니다. 우선, 팀원들과 함께 월드 IT 쇼에 같이 참관하게 됩니다. 침해사고에 대응하는 보안제품과 신기술들을 접해 볼 수 있었고 앞으로의 정보보안과제에 대해 알 수 있었습니다. 또한, 원활한 과제진행을 위해 IT 기업탐방을 신청합니다. 비록 기업보안이 대외비라서 인프라와 기술은 알 수 없었지만, 실무자와 인터뷰를 진행하며 궁금한 점들을 해소할 수 있었습니다. 짧은 시간 안에 친밀감도 쌓고 참여도를 높여 프로젝트를 완수할 수 있었습니다. 이를 계기로 소통과 협조의 중요성을 깨닫게 됩니다. 공사업무 수행 시 팀원들의 의욕저하로 업무수행이 삐걱거릴 때마다 환기할 방법을 모색하여 성공적으로 마칠 수 있도록 일조하겠습니다.  

""헌혈천사"" 군복무시절. 포상휴가를 하루라도 더 받고 싶은 마음으로 헌혈을 시작합니다. 하지만, 작은 사건으로 마음가짐이 달라집니다. 맞선임의 조부님께서 수술하신다는 소식을 듣고 헌혈증을 기부하게 됩니다. 저에게는 작은 행동이 상대방에게 큰 도움이 될 수 있다는 것을 느낀 좋은 기회였습니다. 이를 계기로 사회공헌을 바탕으로 모두의 행복추구가 저의 이념이 되었습니다 
"
동아쏘시오홀딩스(주),DBA·데이터베이스,"
저는 주변 사람들로부터 맡은 일에 대한 책임감이 강하다는 이야기를 자주 듣습니다. 강한 책임감으로 때로는 제 일에 있어 손해를 보곤 하지만 맡은 일을 완수하며 얻는 보람과 성취감은 제 삶의 동력이 되곤 합니다. 학부 시절 저는 저소득층 학생들과 멘토링을 하며 교과목 학습지도를 도와주는 봉사 활동에 참여했습니다. OO 프로젝트를 통해 두 명의 학생과 인연을 맺었고, 학생들의 형편이 안 좋은 만큼 학업적, 심리적으로 도움이 되는 멘토가 되고 싶었습니다. 한정적인 시간을 효율적으로 사용하기 위해 프로그램 계획표를 짜며 체계적으로 수업했고, 학생들과 함께 하교하며 친분을 쌓도록 노력했습니다. 수험생인 학생들을 위해 기존 봉사 기간인 6개월에서 1년으로 연장했고 덕분에 학생들은 만족할만한 수능 성적을 받았습니다. 멘토링을 마치고 집에 돌아오면 12시가 넘어 체력적으로 힘들었지만 학생들에게 잊지 못할 큰 도움이 되었다는 것에 뿌듯했고 책임감의 무게를 행동의 원동력으로 생각하게 되었습니다. 

첫 번째로 필요한 역량은 데이터를 다루고 분석할 수 있는 역량입니다. 저는 학부 시절 SAS, R, SQL, SPSS를 배우는 과목을 수강하며 DB에서 원하는 데이터를 추출하고 통계 프로그래밍을 사용해 인사이트를 찾아내는 분석의 전반적인 과정을 배웠습니다. 또한 분석에 앞서 데이터가 축적되는 ETL과정과 시스템 기획, 구축의 중요성을 깨닫고 데이터베이스 관련 서적을 읽으며 부족한 지식을 쌓았고, SAS와 R에 관한 통계 자격증을 취득하며 데이터 마이닝 기법과 데이터 구조에 대한 심화적 내용을 습득했습니다. 두 번째는 조직력과 커뮤니케이션 역량입니다. 학부 시절 동기들과 함께 빅데이터 공모전에 도전했지만 도중 한 명의 친구가 인턴십에 합격해 많은 시간을 할애할 수 없었습니다. 한정적인 시간 때문에 힘들었지만 각자의 역할을 잘 융합하면 1+1+1은 3이 아닌 10을 만들 수 있다는 것을 알기에 리더를 자초해 각자에 맡는 역할을 분담하였습니다. 컴퓨터 앞에서 일하는 친구는 데이터 클렌징 작업을 맡고 시험을 공부하는 친구가 잘하는 문서 작성과 파일 준비, 시간적 여유가 많은 제가 PPT를 담당했습니다. 결과적으로 40장의 PPT를 성공적으로 완성했으며 이 일을 계기로 상대방의 상황을 이해하고 배려하려는 태도로 조직을 변화시킬 수 있고, 계획적인 일의 분담으로 일의 능률과 사기를 상승시킬 수 있다는 것을 깨달았습니다. 

제가 살아오면서 가장 중요하게 생각하는 가치는 '유비무환'입니다. 중학교 시절 국악부에서 활동하며 학교 대표로 친구들과 연주회에서 공연할 기회가 생겼습니다. 큰 무대인만큼 잠도 못 잘 정도로 걱정을 많이 했습니다. 하지만 부모님은 목표 달성과 성공을 위해선 철저한 연습과 준비만이 해결책이라는 것을 알려주셨고, 저는 손가락에 물집이 생길 정도로 많은 연습을 했습니다. 결과적으로 실수 없이 연주회를 끝마칠 수 있었고 무대를 마친 후 받은 박수와 응원으로 성취감과 희열감을 느낄 수 있었습니다. 이 일을 계기로 높은 목표를 달성하기 위한 준비의 필요성을 깨달았고 새로운 일에 도전할 때는 누구보다 철저하게 준비하는 습관을 가질 수 있었습니다. 이러한 가치관으로 입사 전 인턴 과정을 수료하며 신입 사원이 되기 위한 토대를 마련할 것입니다. IT운영 업무를 수행하기 위해 소프트웨어에 대한 구조와 원리를 배우고 운영 업무의 프로세스를 익혀 동아쏘시오그룹의 전사적 운영 관리에 힘쓰겠습니다. 

빠른 고령화 진행으로 질병 없이 건강하게 육체적, 사회적 활동을 영위하려는 니즈 확대는 제약과 바이오산업에 있어 더 큰 성장 기회를 제공한다고 생각합니다. 실제 국내 제약시장은 전 세계적인 경기 침체에도 지난 5년간 연평균 3%의 성장률을 유지하며 미래 먹거리 산업으로 자리잡았습니다. 이러한 높은 성장 가능성을 가진 동아쏘시오 그룹의 일원이 되어 그룹의 성장을 위한 혁신적인 IT 서비스를 제공하고 싶어 지원하였습니다. 기업의 IT 시스템 성능은 작게는 실적의 차이부터, 크게는 기업의 존립을 좌우할 수 있다고 생각합니다. 다양한 계열사에 맞는 서비스와 인사이트를 제공하여 사업 경쟁력 확보에 이바지해 그룹이 함께 성장해 동아쏘시오그룹이 국내를 넘어 세계적인 제약기업으로 성장하도록 이바지할 것입니다. 
"
카카오게임즈,빅데이터·AI(인공지능),"
""분석적 소비자에서 행동 분석의 대가로"" 저는 분석적 소비자로서 정보를 분석하고 타인에게 전달하는 데 기쁨을 느꼈습니다. 그리고 정보 전달 전과 후에 따라 고객의 반응이 어떻게 달라지는지를 관찰하고 예측하는 것에 큰 관심을 가졌습니다. 고객에게 제시할 정보의 정확성을 높이고자 통계적 능력을 높였습니다. 또한, 이를 실전에 활용하기 위하여 대외활동, 공모전, 인턴십에 참여하는데 시간을 아낌없이 투자하였습니다. 이러한 제 꿈을 실현하기 위한 과정 중 인턴십에 참여하며 게임업계에 대한 입사 의지를 다지게 되었습니다. 커머스기업 인턴 근무 당시 주도적인 데이터 기획과 분석으로 300만 회원의 행동 데이터를 분석하여 온라인 쇼핑 고객의 행동 분석을 시행하였습니다. 이전까지는 온라인 고객의 행동이 미세한 점, 사소한 경험에 영향을 받아 이탈, 유입 등 여러 결과로 반응이 나타날 것이라고 생각하지 못하였습니다. 하지만 분석 과정을 통해 유저의 행동 변화를 파악하는 데 큰 매력을 느끼게 되었습니다. 이에 온라인 속에서 또 하나의 사회를 이루고 있는 게임이라는 분야에서 더 세분된 고객의 행동을 파악하고자 게임업계에서의 근무 의지를 굳건히 다지게 되었습니다.  제 소망과 강점을 직무에 녹이고 살려서 누구나 쉽고 재미있게 즐길 수 있는 게임, 모두 다 함께 즐길 수 있는 게임을 만들어내고 싶습니다. 현실에 안주하지 않고 끊임없는 자기계발을 통해 창의적인 사고, 혁신적인 사고를 키워 미래를 바라볼 수 있는 눈을 가지도록 하겠습니다. 그렇게 적극적인 자세와 뜨거운 열정을 지닌 채 맡은 직무뿐만 아니라 다방면에 능통한 전문가로 탈바꿈하여 게임으로 하나 되는 세상을 만들어가고 싶습니다. 

""Kakao Games Developer Conference 이탈 세션 연사자의 짧은 소개"" 안녕하세요, KDC 게임 이탈 세션의 발표를 맡게 된 신입사원입니다. 5년 전 분석가로 성장하겠다는 의지와 노력 끝에 이 자리에서 그동안의 연구 결과를 발표하게 되어 너무 뿌듯하면서 떨리네요. 입사 초기 탐사분석의 중요성을 깨닫고 소홀히 하지 않은 습관과 항상 노력하며 새로운 것을 습득하려 했던 자세를 가졌습니다. 데이터의 가공과 탐사분석은 모든 분석의 기반이 되는 중요한 준비 작업이기 때문에 제 분석의 튼튼한 기반이 되었습니다. 또한, 회사 내의 교육과 서적을 이용하며 통계 및 새로운 기술 지식의 폭을 넓힐 수 있었습니다.  그리고 사내 강연과 외부 강연을 통해 분석에 대한 자료를 공유하고 제 것으로 만들었습니다. 분석에서 중요한 건 알고리즘이 아니라 어떻게 하면 학습 집합을 잘 만드는가입니다. 그래서 더욱이 공유하는 기회가 중요하기 때문에 학생 시절부터 지금까지 많은 컨퍼런스에 참여하였을 뿐만 아니라 입사 후에는 강연 연사자로 자원하였습니다. 카카오게임즈에 인턴으로 입사하여 게임 분석의 기반을 다지고 1년 차인 지금 이러한 노력 과정을 통해 과거 막연하게 꿈꿨던 '성공적인 이탈 분석을 하자'는 결심은 현실이 되어 과거보다 예측률이 높고 정교한 R 패키지로 개발하는 데까지 이어지게 되었습니다. 이러한 열정은 저희 회사 게임의 성공에 큰 기여를 할 수 있었습니다.  분석이란 분야는 끝없이 발전하고 분석 주제가 무궁무진한 분야라고 생각이 됩니다. 그래서 앞으로의 제 계획은 여전히 예측률 높은 이탈 분석을 진행하여 완벽한 모델링을 이뤄낼 것입니다. 그리고 게임의 초반 경험이 유저에게 미치는 영향, 게임봇 및 이상유저 감지 모델링, 게임 과정 속에서의 마케팅 효율 높이기, 게임 장르별 고객 행동 분석을 진행하여 누구나 쉽게 즐길 수 있는 게임을 만들어 나가고 싶습니다. 첫 개최라 그 열기가 굉장히 기대되네요. 저 또한 불타는 열정을 가득 뿜은 채 이탈 분석 및 R 패키지 개발 과정에 대한 발표를 진행하도록 하겠습니다. 

""경험 위에서 성장하는 자세"" 실패를 인정하고 그 원인을 찾아 제 성장의 밑거름으로 삼아 노력하였습니다. L사의 공모전에 참여하여 개인화 상품 추천 예측 모델링을 직접 구현 및 시도하였습니다. 이때 저희 팀은 어떤 기법을 사용하여 모델링을 할지에 중점을 두고 분석을 하였습니다. 기초 분석을 기반으로 성별, 연령별로 집단을 분류한 후 Apriori 알고리즘을 이용하여 모델링하였습니다. 하지만 그 결과는 입상 실패였습니다. 아쉬웠지만 저희 팀은 실패로 두지 않고 실패의 원인을 찾아 성장의 발판으로 삼고자 하였습니다. 실패의 원인은 머신러닝 기법에 치중한 나머지 데이터 가공과 탐사 분석의 부족으로 분석의 기반이 제대로 자리 잡지 못한 상태였기 때문에 결과 예측률이 수상팀보다 저조했다는 것을 깨닫게 되었습니다. 이 경험에서 얻은 교훈을 통하여 저는 모든 분석을 하기 전 탐사 분석을 소홀히 하지 않고 꼼꼼히 분석하고자 하였습니다. 또한, 전과 같은 실수를 범하지 않기 위해 통계 지식 습득에 힘썼으며 여러 논문을 읽고 AWS 서밋, R컨퍼런스, NDC 등에 참여하여 다양한 분야에서의 분석 현황을 파악하고자 노력하였습니다.  ""노력 끝에 얻은 실현 가능성 있는 분석"" 위에서 시도한 노력을 기반으로 커머스기업 인턴 과정 중 이탈 고객의 행동을 파악하여 마케팅에 반영한 경험이 있습니다. 입사 후 회사에서 사용하는 주요 지표와 고객의 구매 Funnel, UX/UI 분석, 고객의 App 사용성, 구매 분석 등 다양한 시도를 하였습니다. 위 분석들의 과정 중 저는 회사에서 모든 분석의 목적은 신규 유저 유치 혹은 기존 유저의 이탈을 방지하는 것이 가장 큰 목적임을 파악하였습니다.  당시에 마케팅팀에서 이탈 유저에게 마케팅 액션을 진행하고 있었고 이에 대한 더 명확한 문자 발송 기준을 세워야겠다는 생각을 하여 이를 분석 과제 주제로 정하게 되었습니다. 먼저, 탐사 분석을 시도하여 가장 중요한 이탈의 정의를 내리고 고객을 어떻게 분류할지를 시도하였습니다. 그리고 당시 관심이 있던 논문을 참고하여 Cox PH 모델을 기반으로 고객의 생애 주기를 분석하였습니다. 그 결과 특성별 신규 가입자에 대한 이탈 시기를 파악하게 되었습니다. 이를 인액티브 유저에 대한 마케팅 시 문자 발송 주기 설정에 활용하였고 대상 유저의 문자 오픈율을 높였습니다. 이러한 성공이 가능했던 이유는 탐사 분석에 소홀히 하지 않은 결과 정확한 기준의 이탈을 정의 내릴 수 있었고 고객 집단을 분류했기 때문이었습니다. 이로 인해 제 분석 결과는 단순히 과제로 그치지 않고 실제 마케팅에 활용되는 실현 가능한 분석을 진행할 수 있었습니다. 분석은 회사 내 모든 부서, 모든 기획에 영향을 미치는 중요한 분야입니다. 따라서 실패를 인정하고 그것을 교훈으로 삼는 자세가 특히 중요하다고 생각합니다. 제가 지금 이 자리에 있을 수 있는 이유는 실패를 바탕으로 끊임없이 개선해 나가려는 자세 때문입니다. 이 자세를 기반으로 실현 가능한 분석을 시도하기 위해 항상 도전하고 노력하고 있는 점을 기억해 주셨으면 좋겠습니다.  ""실전형 인재, 행동형 인재"" 맡은 업무는 항상 책임감과 행동력을 가지고 성공적으로 이뤄냈습니다. 골든벨 스쿨 봉사단은 중학생에게 보드 게임을 통하여 빅데이터에 대해서 전하는 진로교육 체험을 진행하였습니다. 당시 1기 봉사단이었기에 진행에 대한 기틀이 부족하여 게임 도구 정리시간이 길어지는 문제점이 발생하였습니다. 이를 고치기 위하여 저는 매 수업 과정을 꼼꼼하게 관찰하며 개선점을 찾았고 이를 즉시 반영하여 효과를 살폈습니다. 몇 번의 관찰과 시도 끝에 쌓인 개선점으로 불필요한 시간을 줄이고 명확한 업무 분배를 할 수 있었습니다.  그 결과, 추가정리시간을 40분에서 0분으로 줄이는 성과를 거두었습니다. 이는 봉사단원에게는 문제 해결이라는 기쁨을 주었고 봉사단원의 기쁨은 곧 학생의 만족도로 이어져 감동을 배로 높일 수 있었습니다.  이러한 결과는 제 행동력과 적응력에서 나올 수 있었습니다. 항상 어떠한 도전에도 주저하지 않고 실행시키려고 하였습니다. 이러한 자세는 봉사단의 기틀을 가져 왔을 뿐만 아니라 인턴 근무 당시 빠른 업무 적응력으로 프로젝트를 성공적으로 마무리할 수 있었습니다. 이는 카카오 게임즈 인턴 활동에서도 제 직무능력과 함께 발휘되어 회사의 가치 창출에 더 큰 기여를 할 수 있음을 강조하고 싶습니다.                        
"
