회사,직무,자소서
현대오트론(주),시스템프로그래머,"
어릴 적부터 제 최고의 장난감은 항상 자동차였습니다. 모터카, 프라모델 등 자동차를 가지고 놀며 막연하게 자동차에 관련된 일을 하고 싶었습니다. 후에 소프트웨어 개발에 관심이 생긴 저는 두 가지를 접목해 일을 할 수는 없을까 고민을 많이 하였습니다. 대학 시절 자율주행 자동차 제작 프로젝트를 수행할 때, 초음파 센서를 통한 지형 및 위치 감지, 레이더 센서를 통한 속도 측정 등 데이터를 받아 알고리즘을 작성하고 자동차를 제어하는 과정을 통해 제 진로를 잡았고 더 나은 자동차를 개발하고 싶은 열정이 생겼습니다. 이에 대한 답은 현대오트론이었습니다. 현대오트론에서는 제가 하고 싶은 일인 자동차 소프트웨어 플랫폼 개발을 담당으로 진행하고, 자동차의 발전을 위해 연구하는 기업이었기 때문입니다. 입사 후 프로그래밍 개발 경험을 살려 현대오트론에서 개발 중인 프로젝트에 참가하여 제 역량을 키우고 제 개발자로서의 꿈인 사람들이 제가 개발한 S/W를 편하고 안전하게 이용하는 것을 이루고 싶습니다. 임베디드 및 제어시스템 등 제 전공에서 배우지 못한 기술들을 스스로 공부하기와 선임 개발자들의 조언, 업무 프로세스의 파악을 통해 역량을 키워 제품 개발에 이바지할 것입니다. 그리고 아직 실용화가 되지 않은 친환경 자동차에 대해 실용화에 필요한 기술 제작 및 제어 로직을 집중적으로 연구하여 사람들이 안전하고 믿음직스러운 자동차를 만드는데 기여할 것입니다. 또한, 자율 주행 자동차의 활성화에는 고객의 믿음이 필요합니다. 저는 고객들이 현대를 믿을 수 있도록 믿음을 심어주는 개발을 할 것입니다.                        

프로그램 개발에는 초기 단계부터 투입되어 개발을 진행하는 상황이 있고, 프로젝트 수행 중간에 투입되어 개발을 진행하는 상황이 있습니다. 개발에 있어 프로젝트를 실시할 때, 보통 남이 작성해둔 코드를 바탕으로 코딩을 이어나가는 것이 새로운 프로그램을 만들기보다 어렵다고 합니다. 제가 인턴으로 프로그램을 유지 보수하는 역할을 맡았을 때도, 처음에 프로그램 구조를 익히고 역할을 파악하는 데 있어 어려움을 겪었었습니다. 업무 수행에 필요한 핵심역량은 다른 사람이 작성한 프로그램의 흐름을 빠르게 파악하고 이해해서 자기 것으로 만드는 것이라고 생각합니다. 항상 프로젝트의 초기 단계부터 시작할 수는 없으므로 이 역량은 굉장히 중요하다고 생각합니다. 저는 인턴으로 개발자를 하였을 때, 매일 아침 개발자들과 모임을 해 전날 작성한 코딩에 대해 코드 리뷰를 가졌습니다. 코드 리뷰에서 다른 사람들이 어떤 방식으로 코딩하였으며 자신은 어떤 생각으로 코딩하였는지를 이야기하면서 피드백도 받고, 남의 코드를 빠르게 이해할 수 있는 이해력을 익혔습니다. 이 경험은 코드의 작성법 및 코드의 이해력에 크게 도움이 되고, 후에 진행 중인 프로젝트에 투입되더라도 빠르게 습득하여 코딩할 수 있다는 자신감을 가지게 했습니다. 다른 경험으로, 학교 홈페이지 유지 보수 작업을 하였습니다. 전 개발자가 작성해둔 코드를 보고 프로그램을 이해하고, 새로운 기능의 추가 및 오류 수정 역할을 하면서 코드 이해 능력을 높였습니다. 또한, 제 다음으로 담당할 개발자를 위해 가이드 문서를 작성해 프로젝트의 효율성을 증진했습니다.                        

독일 워킹홀리데이 비자를 발급받아 독일에서 web full-stack 개발자를 한 경험이 있습니다.                        

블록체인 및 암호화폐 기술에 관심이 있어 자동 매매 거래 봇 및 정보 사이트를 만든 경험이 있습니다.                        

암호화폐의 정보를 담은 사이트와 자동 거래 봇을 만들어보고 싶었습니다. 그래서 이 두 개의 프로젝트를 달성하는 것을 목표로 세우고, 진행을 시작하였습니다. 거래 사이트는 JSP maven으로 만들었고, 국내 거래소 및 국외 거래소의 공개 API를 사용해서 데이터를 받아와 시세 및 환율 프리미엄, 변동 등 제가 암호화폐 거래를 하면서 필요했던 데이터를 사이트에 담았습니다. 자동 거래 봇은 세계적으로 거래량이 가장 많은 Binance라는 거래소의 private API를 이용해서 만들었는데, 사용 문서가 복잡해서 원하는 정보만을 얻기가 힘들었지만 제가 이용하는 거래소이며 사람들이 가장 많이 사용하는 거래소라는 점에서 Binance API를 이용하여 만들고 싶은 의지가 강했습니다. 그래서 저는 Binance의 개발자와의 메일, 그리고 텔레그램에서 다른 개발자들과의 소통을 통해 도움을 받으며 개발을 진행하였습니다. 결국, 한 달이라는 시간을 거쳐 지정가 및 시장가 매수와 매도를 수행해주는 봇을 만드는데 완성했습니다. 이 경험을 통해 끊임없는 열정과 노력은 배반하지 않는다는 것을 배웠고, 현대오트론에서 맡은 업무 또한 열정으로 성과를 증명해 발전해나가고 싶습니다.                        

OO대학교 산학연계 프로젝트 사이트 유지 보수 작업을 하였는데, 공동으로 개발하는 개발자와 소통하며 개발을 진행하였습니다.                        

독일에서 개발자를 할 때, POS 프로그램을 프로젝트로 진행한 경험이 있습니다.                        

독일에서 개발자를 할 때, 회사에서 운영하는 가게들의 통합 POS 프로그램을 개발하는 프로젝트를 맡아 선임 개발자 한 명과 디자이너 한 명 총 세 명이 한 팀을 이루어 프로젝트를 실시하였습니다. 매일 아침 개발의 진행에 대해 회의를 하며 디자이너는 간단한 front와 디자인을 맡았고, 저는 DB 관리와 나머지 front 부분을 맡고 선임 개발자는 외부 기기와의 호환, back을 맡았습니다. 체계적인 진행으로 원활한 개발이 이루어져 프로그램을 배포하였지만, 실사용에서 몇 가지 문제가 있었습니다. 사용자가 사용할 때 저희의 생각과는 다른 기능의 추가 및 불필요한 기능의 삭제 등 사용자의 요구를 제대로 수용하지 못했습니다. 그래서 저는 가게 매니저에게 도움을 요청해 사용자의 요구를 조사해 의견을 모아 전달해달라고 하였습니다. 변경사항이 생길 때마다 회의를 진행해서 최대한 사용자가 편리하게 사용할 수 있도록 조율하였습니다. 그 결과 불필요한 수정 작업을 눈에 띄게 줄일 수 있었고, 사용성에서 큰 효율을 보였습니다.  이 경험에서 타인과의 협력이 중요하다는 것을 크게 느꼈고, 팀원들과의 이견 조율 또한 프로젝트의 진행에서 큰 중요성 중 하나라고 배웠습니다.                         
"
네이버웹툰㈜,컨텐츠·사이트운영,"
""잠재력이 있는 산업군에서의 덕업일치"" 잠재력이 큰 시장에서 변화를 주도하는 회사, 즐기며 좋아하는 분야의 회사에서 일하고 싶습니다. 웹툰은 학창시절부터 빠지지 않는 존재였는데, 특히 이말년시리즈같은 개그물을 주로 봤습니다. 야후에서 연재되던 이말년시리즈가 네이버에서 연재되어 좋아하는 만화를 보기 위해 네이버 웹툰을 보기 시작한 뒤부터 지금까지 매일 웹툰을 보고 있습니다. 좋아하기도 하지만, 새로운 컨텐츠가 끊임없이 생기고 여러 기술을 적용할 수 있는 웹툰 시장의 장래성 또한 끌렸습니다. 웹툰은 게임, 영화, 드라마 등 다른 컨텐츠로 파생되기도 하고, VR을 비롯한 다양한 신기술을 적용할 수 있습니다. 그리고 한국뿐만 아니라 해외 시장을 개척할 잠재력 또한 큽니다. 네이버 웹툰은 독자의 편의성을 고려해 오전 12시에 제공되던 웹툰을 오후 11시에 제공하는 등 필요한 서비스를 제공하며, 새로운 컨텐츠를 바탕으로 해외 웹툰 시장을 개척하고 있습니다. 1위의 자리를 유지하고 있지만 끊임없이 개선점을 찾는 네이버 웹툰에 이끌렸으며, 웹툰 시장의 파이를 키우고 싶습니다.   

""인터넷 문화의 흐름을 볼 수 있는 두 어플: 트위치와 9GAG"" 최근에는 트위치나 9GAG를 자주 이용합니다. 두 어플은 인터넷 문화를 활발한 유저 간 소통을 통해 빠르게 이끌고 있습니다. 해당 어플들을 통해서 1인 미디어와 인터넷 컨텐츠를 보며, 인터넷 문화의 최신 트렌드를 알 수 있습니다.우선, 트위치는 실시간 쌍방 소통에 장점을 보이며 유저들의 충성도가 큽니다. 다른 플랫폼에 비해 압도적으로 게임중심 1인 미디어의 비중이 크기 때문입니다. 신작게임이 나오자 마자 다양한 스트리머들이 방송을 하며 일반인 게이머 뿐만 아니라 프로게이머, 심지어 웹툰작가분들도 방송을 하고 있습니다. 즉, 게임이라는 중심가치 아래 다양한 방송인과 시청자가 최신 트렌드를 매개로 소통할 수 있는 점이 트위치를 계속 쓰게끔 하는 원동력입니다. 반면에, 기존 시청자층이 만들어낸 서브컬쳐가 신규 시청자에게 장벽으로 다가와 유입을 어렵게 할 수 있습니다.  9GAG의 장점은 유저들은 자유롭게, 자주 어플을 보며 다양한 컨텐츠를 소비할 수 있다는 점입니다. 어플 내 다양한 카테고리가 있어 이를 선택해서 볼 수 있으며, 컨텐츠들이 피드 형식으로 실시간으로 올라옵니다. 유저들 또한 세계적으로 분포되어 있기 때문에 외국 인터넷 컨텐츠의 트렌드를 볼 수 있습니다. 단점은 어플의 사용시간이 사용자의 의지에 따라 달려있어 꾸준히 쓸 요인이 크게 없고, 유저를 끌어당기는 힘이 적습니다.  ""소통을 통한 몰입도 향상과 선택의 폭 넓히기"" 네이버웹툰은 사용자의 몰입에 있어 두 어플의 중간지점에 있다고 생각합니다. 가벼운 일상툰부터 철학적 의미를 가진 웹툰까지 갖춘 다양한 컨텐츠는 신규 독자를 불러모으며, 편한 인터페이스와 꾸준히 업데이트되는 웹툰들은 기존 유저를 유지시킵니다. 그러나 웹툰을 좋아한다는 가치를 공유하고 있음에도 불구하고, 독자와 작가 사이의 소통이 다소 부족합니다. 현재 네이버 웹툰 어플 내에서 작가는 작품이나 작가의 말, 독자는 베스트 댓글을 통해 소통합니다. 나머지 소통은 개인SNS나 외부 플랫폼을 통해 이뤄지고 있습니다. 네이버 웹툰 내에선 관심작가를 설정하고 그 작가와 피드를 통해 실시간으로 소통할수 있게 한다면 유저 충성도를 제고할 수 있습니다. 또한, 다양한 웹툰들이 있는 만큼 신규 독자에게 카테고리를 제공해줌으로서 선택의 폭을 넓힐 수 있습니다. 현재 웹툰 리스트는 기본적으로 조회수 기준으로 정렬되어 있습니다. 물론, 상단 바에 조회수 뿐만 아니라 별점,댓글 등 다양한 기준으로 웹툰을 정렬시킬 수 있는데 대부분의 유저들은 이를 모릅니다. 카테고리를 세분화시키거나 정렬기준을 더 보여준다면, 신규 유저가 좋아하는 작품을 취사선택하며 독자가 되게 할 수 있습니다. 

네이버 웹툰은 한국 내에서 가장 많은 독자를 보유하고 있으며, 현재 외국으로 진출하며 입지를 세우는 중입니다. 즉, 우리나라에선 1위 자리를 더욱 공고히 굳히고 외국에선 존재감을 각인시켜야 합니다. 이를 위해선 웹툰을 모르는 사람을 입문시키고, 동시에 기존 독자들이 웹툰에 더 애정을 갖게 해야 합니다. 그래서 외국 시장에선 웹툰을 전혀 보지 않는 예시인 전자를, 우리나라 시장에선 웹툰을 너무 많이 보는 후자를 가정하겠습니다. ""흥미를 유발해 웹툰 컨텐츠 입문시키기"" 웹툰 자체를 모르거나 관심이 없는 외국인들은 작가와 독자들 사이의 커뮤니케이션과 같은 작품 외적 요소에 익숙하지 않습니다. 바꿔 말하면, 그들은 웹툰의 그림체, 스토리 등 웹툰의 작품적 요소에 이끌립니다.저는 이러한 외국인들에게 만화 자체가 흥미로우며 문화적 이해가 크게 필요없는 무빙툰을 추천하고 싶습니다. 특히, 호랑 작가의 봉천역 귀신과 같은 단편선의 경우엔 외국인들이 실제로 그 만화를 보고 리액션을 보인 유튜브 영상도 있습니다. 저는 외국인의 관심을 끌기 위해서 그 영상을 보여줘 흥미를 유발할 것 같습니다. 그 뒤, 해당 웹툰이나 비슷한 웹툰의 링크를 보내준다면 실제로 웹툰을 보게끔 할 수 있습니다. 이런 방식으로 유입된 새로운 독자들은 비슷한 유형의 다른 네이버 웹툰의 컨텐츠에 대해 피드백을 남길 수 있고, 공유를 통해 또 다른 새로운 독자를 유입시킬 수 있습니다.  ""익숙한 작가의 신작 홍보하기"" 웹툰을 많이 보지만 볼 게 없다는 우리나라 사람들은 많은 작품과 그 작품을 만든 작가분들에게 익숙합니다. 최근 네이버 웹툰은 많은 신작을 선보여 독자들의 선택의 폭을 넓혔습니다. 그러나 오히려 이런 점들은 기존 독자들에게 익숙하지 않은 작품들을 많이 노출시켜 작품 선택을 어렵게 할 수 있습니다. 이런 독자들에게 김규삼 작가님의 신작 '비질란테'를 추천하고 싶습니다. 이 작품은 독자들에게 익숙한 작가가 색다른 스토리로 풀어내는 신작 웹툰이기 때문입니다. 작품을 본 해당 독자들은 편안함과 동시에 새로움을 느낄 것이고, 본인이 아는 다른 작가의 신작은 없는 지 살펴보며 신작 웹툰을 살펴볼 것입니다. 이런 독자층에게 만화를 알리기 위해 장면의 일부분을 캡처해 보여주고 싶습니다. 기존 독자들은 아는 작가의 그림체에 익숙하고, 보지 못했던 장면에 흥미를 느낄 수 있기 때문입니다. 해당 기능은 네이버 웹툰 앱에 겟짤툰이라는 기능으로 내장되어 있어 자체적으로 공유할 수 있고, 해당 요일 웹툰에 게시되어 있다고 전하면 웹툰 인터페이스에 익숙한 독자들은 찾아가 그 웹툰을 감상할 것입니다.  ""공유의 불편함, 개선점"" 과거엔 캡처를 해서 웹툰의 재밌는 부분을 공유했지만, 현재 주변 사람들에게 웹툰 장면을 공유하지 않습니다. 현재 컷툰에서는 컷을 바로 공유할 수 있지만, 스크롤형 만화에서 장면을 공유하기 위해선 겟짤툰이라는 내장 기능을 사용해야 합니다. 그러나, 실제로 만화의 특정 장면을 공유하기 위해 해당 기능을 사용하려고 시도했을 때, 공유를 하기까지 여러 단계가 있어 불편했습니다. 겟짤툰의 저장 진행 방식만 수정한다면 독자 간 공유의 불편함을 해소하고 다시 웹툰을 활발히 공유하게 할 수 있다고 생각합니다. 특히, 모든 과정을 거친 뒤 저장 여부를 결정하기보다는 첫 단계인 영역 설정 뒤 저장 여부를 결정하고, 그 뒤에 추가적인 단계를 거치게 하면 예전과 같은 저장 과정을 가지되 추가적인 내장 기능 또한 살릴 수 있습니다. 과정을 다 거친 뒤엔 겟!짤툰이라는 게시판에 본인의 캡처를 올릴 수 있지만 이는 추천 수와 업데이트 빈도로 봤을 때 컷툰 베스트댓글이라는 대체제가 있기에 파급력이 적고 사람들도 많이 찾지 않습니다. 공유 기능을 간소화하는 약간의 기능 수정만으로도 예전과 같은 개인적 소통을 가능케 할 수 있고, 이는 새로운 독자를 진입하게 할 수 있습니다. 
"
(주)안랩,응용프로그래머,"
저는 몇 년 전 발생했던 국내 통신사와 카드사에서의 개인정보유출사건을 보면서 저런 대기업도 정보유출이 발생한다는 것이 신기해하면서도 그로 인한 다량의 스팸 문자로 많은 불편함을 느꼈습니다. 또한, OO교육센터에서 데이터베이스를 활용한 사용자 관리 시스템과 사용자에 따른 접근제어 시스템을 구현해보면서 당연하다고 생각했던 보안시스템의 중요성에 대해 느끼게 되었습니다. 제가 안랩의 일원이 된다면, 사용자의 개인정보가 등록된 곳들의 정보를 수집하여 리스트를 만들어, 각각의 사이트들의 광고나 서비스 수신을 관리해주며, 만약 다른 곳에서 개인정보가 유출되더라도 사용자가 이전에 가입하거나 방문한 적이 없는, 사용자와 전혀 관련 없는 곳에서 스팸 문자나 메일 등이 날아온다면 이를 일절 차단하고 정보가 어디서 유출됐는지 추적해주는 프로그램을 만들어 저를 포함한 많은 사람의 불편함을 없애줄 수 있는 보안개발자가 되고 싶습니다. 

최근 이동통신 3사와 삼성전자 등 7개의 기업에서 블록체인을 기반으로 모바일 증명서 앱을 개발한다고 이슈가 되고 있습니다. 이 앱을 통해 졸업, 성적증명서 등을 제출할 수 있고, 학생증이나 신분증을 따로 들고 다닐 필요 없이 스마트폰을 통해 어디서든 손쉽게 인증할 수 있게 하는 것이 목표라고 합니다. 모든 것이 스마트화되는 시대에 이 기술은 많은 이들에게 편의성을 제공하겠지만, 앱 안에 사용자의 온갖 개인정보가 들어가 있기 때문에 훨씬 강화된 보안이 필요할 것입니다.  이를 특정 조직이나 개인들만 참여할 수 있는 프라이빗 블록체인을 기반으로 한다면 좀 더 효과적이겠지만, 추가적인 보안 솔루션이 필요할 것으로 생각됩니다. 또한, 앱을 통해 특정 증명서를 발급받더라도 스마트폰에 직접 저장되는 것이 아니라, 사용하거나 전송할 때 기업 측 서버에게 매번 요청하고 공인인증서처럼 매번 개인인증을 거쳐야 하는 방식이라면, 그만큼 기업 간의 승인시스템이 복잡해질 것으로 생각됩니다. 

대학교 4학년 때 친구들과 함께 ‘4가지 기능을 가진 전자의수’라는 주제로 M2M 경진대회에 참여했었습니다. 문제는 평가 당일 날 발생했습니다. 평가장소에 가서 세팅을 마치고 테스트를 하던 중, 새로 만든 모터드라이브로 인해 보드가 타버리는 바람에 기존 거로 교체해도 동작이 되지 않았습니다. 여분의 보드가 없던 저희는 긴급회의를 통해 보드 없이 시연하기 위한 대책을 세우며 평가준비를 하였습니다. 직접적인 동작을 보여주진 못했지만, 각자 역할에 충실하게 팀원 1명은 하드웨어에 관해 설명을 하였고, 소프트웨어 담당인 저는 코드에 의한 동작 구조를 설명하였으며, 나머지 팀원이 전자의수의 모티브였던 프로젝트의 시연 영상과 중간중간 찍었던 테스트 영상을 보여주며 시연을 무사히 마쳤습니다. 그 결과, 동작을 보여주지 못했음에도 불구하고 꽤 좋은 평가를 받아 장려상을 수상할 수 있었습니다. 이 경험을 통해 팀워크의 중요성과 여분의 재료, 시연 영상의 필요성을 크게 깨닫게 되었습니다. 

""성공적인 인간관계"" 저는 인간관계를 잘해왔다고 생각합니다. 학창시절 내성적인 성격으로 인해 상대방을 배려하는 자세가 습관이 되다 보니 저를 좋게 봐주는 사람이 많아졌고, 동아리와 학생회 등을 해오며 다양한 사람들과 친해져 지속적인 관계를 유지해오고 있습니다. ""팀워크의 달인"" 저는 지금까지 집단활동을 해오면서 모임 내에서 누군가 이탈하거나 불화가 생긴 적이 없습니다. 프로젝트에서 SW개발 담당을 맡아왔지만, 팀원들의 의견을 적극적으로 수용했으며, 조별과제에서도 조원들끼리 빨리 친해질 수 있도록 먼저 다가갔고, 역할분배나 모임도 먼저 주도하면서 무임승차하는 사람 없이 잘해올 수 있었습니다. ""다방면 지식"" 저는 대학과정을 통해 하드웨어부터 소프트웨어, 프로그래밍까지 IT 관련 지식의 기반을 다졌고, 전문교육과정을 통해 웹 프로그래밍과 안드로이드, DBMS 등을 배우며 전문지식을 넓혔습니다. 이렇게 쌓아온 지식은 다양한 보안시스템을 만드는 데 큰 도움이 될 것이라 생각합니다. 
"
